[
  {
    "id": "makar.design.tokens.semantic_roles",
    "title": "Use semantic design-token roles",
    "domain": "design-systems",
    "type": "principle",
    "level": "L3",
    "status": "active",
    "importance": 0.98,
    "confidence": 1,
    "source_type": "project_architecture",
    "sources": [
      "packages/design-tokens",
      "docs/FRONTEND_PRINCIPLES.md"
    ],
    "prerequisites": [],
    "related": [
      "makar.ui.primitives.no_raw_theme_values"
    ],
    "examples": [
      "accent, surface, textPrimary instead of component-local color literals"
    ],
    "anti_patterns": [
      "hard-coded ALINA palette inside shared UI components"
    ],
    "tests": [
      "shared primitive contains no theme-specific raw color"
    ],
    "projects_used_in": [
      "alina-control-center"
    ],
    "last_verified_at": null
  },
  {
    "id": "makar.ui.primitives.no_raw_theme_values",
    "title": "Shared UI primitives remain theme-agnostic",
    "domain": "ui",
    "type": "constraint",
    "level": "L3",
    "status": "active",
    "importance": 1,
    "confidence": 1,
    "source_type": "project_architecture",
    "sources": [
      "docs/ARCHITECTURE.md"
    ],
    "prerequisites": [
      "makar.design.tokens.semantic_roles"
    ],
    "related": [],
    "examples": [
      "GlassPanel consumes surface/border/glow tokens"
    ],
    "anti_patterns": [
      "importing ALINA app theme constants into packages/ui"
    ],
    "tests": [
      "packages/ui does not depend on apps/alina-control-center"
    ],
    "projects_used_in": [
      "alina-control-center"
    ],
    "last_verified_at": null
  },
  {
    "id": "makar.motion.reduced_motion",
    "title": "Motion requires reduced-motion fallback",
    "domain": "motion",
    "type": "principle",
    "level": "L7",
    "status": "active",
    "importance": 0.95,
    "confidence": 1,
    "source_type": "quality_rule",
    "sources": [
      "docs/FRONTEND_PRINCIPLES.md"
    ],
    "prerequisites": [],
    "related": [],
    "examples": [
      "disable decorative parallax when prefers-reduced-motion is active"
    ],
    "anti_patterns": [
      "cinematic motion with no non-animated path"
    ],
    "tests": [
      "reduced-motion mode remains fully usable"
    ],
    "projects_used_in": [
      "alina-control-center"
    ],
    "last_verified_at": null
  },
  {
    "id": "makar.qa.visible_focus",
    "title": "Interactive controls expose visible keyboard focus",
    "domain": "quality",
    "type": "test",
    "level": "L11",
    "status": "active",
    "importance": 0.96,
    "confidence": 1,
    "source_type": "quality_rule",
    "sources": [
      "experiments/M0.2/ACCEPTANCE.md"
    ],
    "prerequisites": [],
    "related": [],
    "examples": [
      "focus-visible ring uses semantic focus token"
    ],
    "anti_patterns": [
      "mouse-only affordance"
    ],
    "tests": [
      "tab navigation shows visible focus for every interactive primitive"
    ],
    "projects_used_in": [
      "alina-control-center"
    ],
    "last_verified_at": null
  },
  {
    "id": "makar.stream.priority.primary",
    "title": "Primary stream owns visual attention",
    "domain": "information-streams",
    "type": "pattern",
    "level": "L5",
    "status": "active",
    "importance": 0.9,
    "confidence": 0.95,
    "source_type": "project_architecture",
    "sources": [
      "docs/FRONTEND_PRINCIPLES.md"
    ],
    "prerequisites": [],
    "related": [],
    "examples": [
      "active task is primary; background indexing is visually suppressed"
    ],
    "anti_patterns": [
      "all events rendered with equal urgency"
    ],
    "tests": [
      "background activity cannot visually overpower primary task"
    ],
    "projects_used_in": [
      "alina-control-center"
    ],
    "last_verified_at": null
  },
  {
    "id": "makar.avatar.presentation_independence",
    "title": "Avatar identity is independent from presentation mode",
    "domain": "avatar-ui",
    "type": "principle",
    "level": "L8",
    "status": "active",
    "importance": 0.88,
    "confidence": 1,
    "source_type": "project_architecture",
    "sources": [
      "docs/FRONTEND_PRINCIPLES.md"
    ],
    "prerequisites": [],
    "related": [],
    "examples": [
      "ALINA can switch from full-body hologram to compact assistant without losing state"
    ],
    "anti_patterns": [
      "avatar business state embedded inside one 3D scene"
    ],
    "tests": [
      "avatar state survives presentation-mode switch"
    ],
    "projects_used_in": [
      "alina-control-center"
    ],
    "last_verified_at": null
  },
  {
    "id": "makar.workspace.state.presentation_separation",
    "title": "Workspace presentation state is separate from domain data",
    "domain": "workspace",
    "type": "principle",
    "level": "L4",
    "status": "active",
    "importance": 1,
    "confidence": 1,
    "source_type": "project_architecture",
    "sources": [
      "docs/ARCHITECTURE.md",
      "docs/FRONTEND_PRINCIPLES.md"
    ],
    "prerequisites": [],
    "related": [
      "makar.workspace.layout.serializable"
    ],
    "examples": [
      "panel focus/collapse/dock state can change without mutating document/task data"
    ],
    "anti_patterns": [
      "storing domain payload inside layout nodes"
    ],
    "tests": [
      "workspace transitions do not modify panel domain payload references"
    ],
    "projects_used_in": [
      "alina-control-center"
    ],
    "last_verified_at": null
  },
  {
    "id": "makar.workspace.layout.serializable",
    "title": "Workspace layout state must be serializable",
    "domain": "workspace",
    "type": "constraint",
    "level": "L4",
    "status": "active",
    "importance": 0.98,
    "confidence": 1,
    "source_type": "project_architecture",
    "sources": [
      "packages/workspace-engine/README.md"
    ],
    "prerequisites": [
      "makar.workspace.state.presentation_separation"
    ],
    "related": [
      "makar.workspace.panel.stable_ids"
    ],
    "examples": [
      "JSON-safe layout with panel IDs, regions, order, focus and collapsed state"
    ],
    "anti_patterns": [
      "React elements/functions stored directly in persisted workspace state"
    ],
    "tests": [
      "JSON.stringify/parse preserves equivalent workspace state"
    ],
    "projects_used_in": [
      "alina-control-center"
    ],
    "last_verified_at": null
  },
  {
    "id": "makar.workspace.panel.stable_ids",
    "title": "Workspace panels reference content through stable IDs",
    "domain": "workspace",
    "type": "pattern",
    "level": "L4",
    "status": "active",
    "importance": 0.94,
    "confidence": 1,
    "source_type": "project_architecture",
    "sources": [
      "issues/9"
    ],
    "prerequisites": [],
    "related": [
      "makar.workspace.layout.serializable"
    ],
    "examples": [
      "panel id 'knowledge-graph' + contentType 'knowledge-graph' instead of embedding component instance"
    ],
    "anti_patterns": [
      "persisting component closures inside workspace model"
    ],
    "tests": [
      "registered panel IDs remain deterministic across save/restore"
    ],
    "projects_used_in": [
      "alina-control-center"
    ],
    "last_verified_at": null
  },
  {
    "id": "makar.qa.scoped_semantic_selectors",
    "title": "Visual tests scope semantic selectors when repeated labels are valid",
    "domain": "quality",
    "type": "lesson",
    "level": "L11",
    "status": "active",
    "importance": 0.82,
    "confidence": 1,
    "source_type": "experiment_result",
    "sources": [
      "experiments/M0.3/RESULT.md",
      "CI run 35922359241"
    ],
    "prerequisites": [
      "makar.qa.visible_focus"
    ],
    "related": [],
    "examples": [
      "scope DEMO / MOCK assertion to the intended header or use an explicit first/region locator"
    ],
    "anti_patterns": [
      "global strict text locator when the UI intentionally repeats the same status label"
    ],
    "tests": [
      "Playwright selectors remain unambiguous after adding another legitimate status badge"
    ],
    "projects_used_in": [
      "alina-control-center"
    ],
    "last_verified_at": null
  },
  {
    "id": "makar.stream.semantic_priority",
    "title": "Stream semantic class is independent from arrival order",
    "domain": "information-streams",
    "type": "principle",
    "level": "L5",
    "status": "active",
    "importance": 1,
    "confidence": 1,
    "source_type": "project_architecture",
    "sources": [
      "docs/FRONTEND_PRINCIPLES.md",
      "issues/11"
    ],
    "prerequisites": [],
    "related": [
      "makar.stream.priority.primary",
      "makar.stream.attention_budget"
    ],
    "examples": [
      "an older primary task remains above a newer background indexing event"
    ],
    "anti_patterns": [
      "render newest event as most important by default"
    ],
    "tests": [
      "background event cannot outrank primary solely by timestamp"
    ],
    "projects_used_in": [
      "alina-control-center"
    ],
    "last_verified_at": null
  },
  {
    "id": "makar.stream.attention_budget",
    "title": "Attention budget caps simultaneous high-prominence information",
    "domain": "information-streams",
    "type": "pattern",
    "level": "L5",
    "status": "active",
    "importance": 0.96,
    "confidence": 1,
    "source_type": "project_architecture",
    "sources": [
      "docs/knowledge/KB_2_ALINA_AGENT_DELIVERY.md",
      "issues/11"
    ],
    "prerequisites": [
      "makar.stream.semantic_priority"
    ],
    "related": [
      "makar.stream.interruption_policy"
    ],
    "examples": [
      "one primary plus bounded alerts while background work stays collapsed"
    ],
    "anti_patterns": [
      "all streams request full visual attention"
    ],
    "tests": [
      "selection honors configured maximums per semantic class"
    ],
    "projects_used_in": [
      "alina-control-center"
    ],